{
  "_type": "https://in-toto.io/Statement/v1",
  "subject": [
    {
      "name": "change",
      "digest": {
        "gitCommit": "9b2fbdd4e52bcbb0abb2b61abd3888a1551152a6"
      }
    }
  ],
  "predicateType": "https://github.com/jvanheerikhuize/asdlc/spec/predicates/agent-usage/v1",
  "predicate": {
    "change_id": "CR-20260716-004-lead-and-agent-cycle-metrics",
    "source": "claude-code session transcript",
    "window": {
      "from": "2026-07-16T16:46:15Z",
      "to": "2026-07-16T16:47:01Z"
    },
    "tokens": {
      "input": 12,
      "output": 7423,
      "cache_read": 347260,
      "cache_creation": 10355,
      "total": 365050
    },
    "produced_by": {
      "role": "implementer",
      "kind": "agent",
      "identity": "github:jvanheerikhuize",
      "agent": {
        "vendor": "Anthropic",
        "model": "claude-sonnet-5"
      }
    },
    "produced_at": "2026-07-16T16:47:01Z"
  }
}
