{
  "_type": "https://in-toto.io/Statement/v1",
  "subject": [
    {
      "name": "change",
      "digest": {
        "gitCommit": "12cb3acc6f936d0169d2592057ae58344ee8018f"
      }
    }
  ],
  "predicateType": "https://github.com/jvanheerikhuize/asdlc/spec/predicates/classification/v1",
  "predicate": {
    "change_id": "CR-20260714-leftovers-registry",
    "risk": "low",
    "data": "none",
    "ai_usage": "generated",
    "ai_system_tier": "none",
    "rationale": "Knowledge-base and schema-enum addition inside the framework's own repo; no production code paths, no data, no AI capability shipped.",
    "produced_by": {
      "role": "intent-owner",
      "kind": "agent",
      "identity": "github:jvanheerikhuize",
      "agent": {
        "vendor": "Anthropic",
        "model": "claude-fable-5"
      }
    },
    "produced_at": "2026-07-14T20:52:00Z",
    "refs": []
  }
}
