{
  "_type": "https://in-toto.io/Statement/v1",
  "subject": [
    {
      "name": "change",
      "digest": {
        "gitCommit": "9310e52bf2febc327e3827bc4adbb7b993a0d1e7"
      }
    }
  ],
  "predicateType": "https://github.com/jvanheerikhuize/asdlc/spec/predicates/classification/v1",
  "predicate": {
    "change_id": "CR-20260715-001-leftover-sweep-d14",
    "risk": "low",
    "data": "none",
    "ai_usage": "generated",
    "ai_system_tier": "none",
    "rationale": "Closes three of the five registered leftovers using only tools and access available in this repo; the remaining two (plus asdlc-verify's share of the Actions bump) need a Go toolchain or cross-repo access and are left for a human playbook.",
    "produced_by": {
      "role": "intent-owner",
      "kind": "human",
      "identity": "github:jvanheerikhuize"
    },
    "produced_at": "2026-07-15T14:54:14Z",
    "refs": []
  }
}
