{
  "_type": "https://in-toto.io/Statement/v1",
  "subject": [
    {
      "name": "change",
      "digest": {
        "gitCommit": "2ed00ea8651f9e8fd53b31452ea12e5fdd44c1e8"
      }
    }
  ],
  "predicateType": "https://github.com/jvanheerikhuize/asdlc/spec/predicates/classification/v1",
  "predicate": {
    "change_id": "CR-20260715-008-granular-token-usage",
    "risk": "low",
    "data": "none",
    "ai_usage": "generated",
    "ai_system_tier": "minimal",
    "rationale": "Knowledge-only change (roadmap + reference nodes, one link edit); no gate, tool, or schema behavior changes; follows knowledge-first convention before any usage.py v2 implementation",
    "produced_by": {
      "role": "intent-owner",
      "kind": "human",
      "identity": "github:jvanheerikhuize"
    },
    "produced_at": "2026-07-15T20:14:11Z",
    "refs": []
  }
}
