{
  "_type": "https://in-toto.io/Statement/v1",
  "subject": [
    {
      "name": "change",
      "digest": {
        "gitCommit": "ece5cf3b61ff2aec9741ce22b8ebb0b93515fad9"
      }
    }
  ],
  "predicateType": "https://github.com/jvanheerikhuize/asdlc/spec/predicates/classification/v1",
  "predicate": {
    "change_id": "CR-20260714-knowledge-scoping",
    "risk": "low",
    "data": "none",
    "ai_usage": "generated",
    "ai_system_tier": "none",
    "rationale": "Knowledge-base-only change recording an architectural decision; no code paths, no data, no AI capability shipped.",
    "produced_by": {
      "role": "intent-owner",
      "kind": "agent",
      "identity": "github:jvanheerikhuize",
      "agent": {
        "vendor": "Anthropic",
        "model": "claude-fable-5"
      }
    },
    "produced_at": "2026-07-14T20:37:00Z",
    "refs": []
  }
}
